url,id,title,desc,tag,category,organization,num_of_downloads,updated_date,format,publication_date,update_frequency,updated_on_time,publication_type,num_of_files,num_of_visits,download_rate,download_rate_fixed,external
http://www.datashanghai.gov.cn/query!queryGdsDataInfoById.action?type=0&dataId=AC8002015005,AC8002015005,药品生产企业信息,药品生产企业的基本情况信息，包含许可证编号、企业名称、注册地址、生产地址、法定代表人、生产范围等,"药品,药品生产,企业",卫生健康,上海市食品药品监督管理局,23,2015年01月23日更新,XLS,1/23/2015,二周,不按时,特定公开,1,67,34.33%,102.99%,非外链
http://www.datashanghai.gov.cn/query!queryGdsDataInfoById.action?type=0&dataId=AC8002015003,AC8002015003,食品餐饮企业查询信息,食品餐饮企业的基本情况信息，包含许可证编号、企业名称、地址、类别、法定代表人（负责人或业主）等,"食品,食品餐饮,企业",卫生健康,上海市食品药品监督管理局,34,2015年01月23日更新,XLSX,1/23/2015,二周,不按时,特定公开,1,80,42.50%,127.50%,非外链
http://www.datashanghai.gov.cn/query!queryGdsDataInfoById.action?type=0&dataId=AC8002015002,AC8002015002,食品流通企业信息,食品流通企业的基本情况信息，包含许可证编号、企业名称、注册地址、生产地址、产品名称等,"食品,食品流通,企业",卫生健康,上海市食品药品监督管理局,30,2015年01月23日更新,XLSX,1/23/2015,二周,不按时,特定公开,1,83,36.14%,108.43%,非外链
http://www.datashanghai.gov.cn/query!queryGdsDataInfoById.action?type=0&dataId=AH0002015001,AH0002015001,勘察企业资质,勘察企业资质，包括企业编码、企业名称、资质名称、等级、承接范围、批准时间、有效截止日期等信息,"勘察,资质",城市建设,上海市城乡建设和管理委员会,5,2015年01月21日更新,XLSX,1/21/2015,每季度,不按时,普通公开,1,33,15.15%,45.45%,非外链
http://www.datashanghai.gov.cn/query!queryGdsDataInfoById.action?type=0&dataId=AH0002015007,AH0002015007,招标代理机构资质,招标代理机构资质，包括企业编码、企业名称、资质名称、等级、承接范围、批准时间、有效截止日期等信息,招标代理机构资质,城市建设,上海市城乡建设和管理委员会,56,2015年01月21日更新,XLSX,1/21/2015,每季度,不按时,普通公开,1,116,48.28%,144.83%,非外链
http://www.datashanghai.gov.cn/query!queryGdsDataInfoById.action?type=0&dataId=AH0002015006,AH0002015006,造价咨询企业资质,造价咨询企业资质，包括企业编码、企业名称、资质名称、等级、承接范围、批准时间、有效截止日期等信息,造价咨询企业资质,城市建设,上海市城乡建设和管理委员会,58,2015年01月21日更新,XLSX,1/21/2015,每季度,不按时,普通公开,1,77,75.32%,225.97%,非外链
http://www.datashanghai.gov.cn/query!queryGdsDataInfoById.action?type=0&dataId=AH0002015005,AH0002015005,施工企业资质,施工企业资质，包括企业编码、企业名称、资质名称、等级、承接范围、批准时间、有效截止日期等信息,施工企业资质,城市建设,上海市城乡建设和管理委员会,10,2015年01月21日更新,XLSX,1/21/2015,每季度,不按时,普通公开,1,33,30.30%,90.91%,非外链
http://www.datashanghai.gov.cn/query!queryGdsDataInfoById.action?type=0&dataId=AH0002015004,AH0002015004,设计企业资质,设计企业资质，包括企业编码、企业名称、资质名称、等级、承接范围、批准时间、有效截止日期等信息,设计企业资质,城市建设,上海市城乡建设和管理委员会,18,2015年01月21日更新,XLSX,1/21/2015,每季度,不按时,普通公开,1,78,23.08%,69.23%,非外链
http://www.datashanghai.gov.cn/query!queryGdsDataInfoById.action?type=0&dataId=AB8002015002,AB8002015002,计生事务受理机构,本市的计生事务受理机构的机构名称、机构地址、电话和邮编信息。更新频率没一年一次。,计生,机构团体,上海市卫生和计划生育委员会,28,2015年01月21日更新,XLSX,1/21/2015,每年,未到更新时间,普通公开,1,59,47.46%,142.37%,非外链
http://www.datashanghai.gov.cn/query!queryGdsDataInfoById.action?type=0&dataId=AH0002015003,AH0002015003,监理企业资质,监理企业资质，包括企业编码、企业名称、资质名称、等级、承接范围、批准时间、有效截止日期等信息,监理资质,城市建设,上海市城乡建设和管理委员会,31,2015年01月21日更新,XLSX,1/21/2015,每季度,不按时,普通公开,1,83,37.35%,112.05%,非外链
http://www.datashanghai.gov.cn/query!queryGdsDataInfoById.action?type=0&dataId=AB8002015001,AB8002015001,人口计生综合服务站,本市的人口计生综合服务站的名称、地址、电话、邮编信息。更新的频率为每年一次。,计生,卫生健康,上海市卫生和计划生育委员会,126,2015年01月21日更新,XLSX,1/21/2015,每年,未到更新时间,普通公开,1,83,151.81%,455.42%,非外链
http://www.datashanghai.gov.cn/query!queryGdsDataInfoById.action?type=0&dataId=AH2002015003,AH2002015003,公共厕所,提供的数据为全市隶属于环卫行业管理的公共厕所信息，主要包括：地址、蹲位、名称等。有地理数据。,公共厕所，地址,民生服务,上海市绿化和市容管理局,44,2015年01月21日更新,XLS,1/13/2015,每半年,未到更新时间,特定公开,1,135,32.59%,97.78%,非外链
http://www.datashanghai.gov.cn/query!queryGdsDataInfoById.action?type=0&dataId=AH2002015004,AH2002015004,公园绿地,所提供的数据为全市公共绿地属性数据与地理数据。包括：公共绿地和公园绿地。,公园绿地,民生服务,上海市绿化和市容管理局,28,2015年01月21日更新,XLS,1/13/2015,每半年,未到更新时间,特定公开,1,119,23.53%,70.59%,非外链
http://www.datashanghai.gov.cn/query!queryGdsDataInfoById.action?type=0&dataId=AH2002015005,AH2002015005,古树名木,数据为全市所有古树名木的信息。有地理数据。包括：地址、所属区县和街道，树龄等。,古树名木,民生服务,上海市绿化和市容管理局,31,2015年01月21日更新,XLS,1/13/2015,每年,未到更新时间,特定公开,1,101,30.69%,92.08%,非外链
http://www.datashanghai.gov.cn/query!queryGdsDataInfoById.action?type=0&dataId=AH2002015001,AH2002015001,绿化市容管理与服务机构,绿化市容管理与服务机构、地址、联系方式、邮编。可主公开查询。,机构名称，联系地址,机构团体,上海市绿化和市容管理局,117,2015年01月21日更新,XLS,1/12/2015,每年,未到更新时间,特定公开,1,97,120.62%,361.86%,非外链
http://www.datashanghai.gov.cn/query!queryGdsDataInfoById.action?type=0&dataId=AH2002015008,AH2002015008,野生动植物重要栖息地,全市野生动植物重要栖息地，主要包括：名称、级别、主要保护对象、保护规划面积、行政区域、建立规划时间。,野生动植物重要栖息地,民生服务,上海市绿化和市容管理局,51,2015年01月21日更新,XLS,1/13/2015,每年,未到更新时间,特定公开,1,77,66.23%,198.70%,非外链
http://www.datashanghai.gov.cn/query!queryGdsDataInfoById.action?type=0&dataId=AA5002015001,AA5002015001,科技管理与服务机构,上海市科学技术委员会所属的科技管理与服务机构一览表（包括机构名称、地址、类型、服务时间、内容以及联系电话等）,科技管理，服务机构,教育科技,上海市科学技术委员会,83,2015年01月20日更新,XLS,1/19/2015,每年,未到更新时间,普通公开,1,143,58.04%,174.13%,非外链
http://www.datashanghai.gov.cn/query!queryGdsDataInfoById.action?type=0&dataId=AD4002012005,AD4002012005,上海市白蚁防治机构一览表,上海市白蚁防治机构一览表，包括机构的区县、单位名称、单位地址、联系电话,白蚁防治,民生服务,上海市住房保障和房屋管理局,160,2015年01月20日更新,XLS,11/22/2012,每月,不按时,普通公开,1,163,98.16%,294.48%,非外链
http://www.datashanghai.gov.cn/query!queryGdsDataInfoById.action?type=0&dataId=AD4002012008,AD4002012008,各区（县）房屋应急维修信息,全市各区（县）房屋应急维修中心的名称、地址和邮编信息。,应急维修,城市建设,上海市住房保障和房屋管理局,59,2015年01月20日更新,XLS,11/22/2012,每年,按时,普通公开,1,79,74.68%,224.05%,非外链
http://www.datashanghai.gov.cn/query!queryGdsDataInfoById.action?type=0&dataId=AD4002012002,AD4002012002,房地产经纪企业基本信息,"房地产经纪企业基本信息,包括企业名称、证书编号、发证日期信息。",房地产经纪企业,城市建设,上海市住房保障和房屋管理局,758,2015年01月20日更新,XLS,12/4/2012,每年,按时,普通公开,1,395,191.90%,575.70%,非外链
http://www.datashanghai.gov.cn/query!queryGdsDataInfoById.action?type=0&dataId=AD4002012016,AD4002012016,拆除施工企业信息,包含拆除施工企业信息包括企业名称、单位地址、联系人资质等级信息。,拆除施工企业,城市建设,上海市住房保障和房屋管理局,54,2015年01月20日更新,XLS,12/18/2012,每年,按时,普通公开,1,74,72.97%,218.92%,非外链
http://www.datashanghai.gov.cn/query!queryGdsDataInfoById.action?type=0&dataId=AD4002012009,AD4002012009,房管行业岗位水平证书信息,房管行业相关岗位水平考试证书信息，包括证书编号、证书名称、发证日期、发证单位等信息。,房管行业，岗位水平证书,城市建设,上海市住房保障和房屋管理局,360,2015年01月20日更新,XLS,11/22/2012,每年,按时,普通公开,2,115,156.52%,469.57%,非外链
http://www.datashanghai.gov.cn/query!queryGdsDataInfoById.action?type=0&dataId=AD4002012010,AD4002012010,保障房工程项目信息,保障房工程项目信息，包括项目名称、总建筑面积、开发单位、设计单位、施工单位等信息。,保障房工程,城市建设,上海市住房保障和房屋管理局,1310,2015年01月20日更新,XLS,11/22/2012,每季度,不按时,普通公开,3,1042,41.91%,125.72%,非外链
http://www.datashanghai.gov.cn/query!queryGdsDataInfoById.action?type=0&dataId=AD4002012022,AD4002012022,直属事业单位名录,直属事业单位名录包括名称、邮编、电话信息,直属事业单位,机构团体,上海市住房保障和房屋管理局,236,2015年01月20日更新,XLS,12/14/2012,每年,按时,普通公开,1,172,137.21%,411.63%,非外链
http://www.datashanghai.gov.cn/query!queryGdsDataInfoById.action?type=0&dataId=AD4002012007,AD4002012007,上海市商品住宅维修资金专户年度归集和划转统计表,上海市商品住宅维修资金专户年度归集和划转统计表，包括单位、当年归集金额、当前划转金额、当年新增归集金额,维修资金,城市建设,上海市住房保障和房屋管理局,55,2015年01月20日更新,XLS,11/22/2012,每年,按时,普通公开,1,77,71.43%,214.29%,非外链
http://www.datashanghai.gov.cn/query!queryGdsDataInfoById.action?type=0&dataId=AD4002012006,AD4002012006,各区房地集团直管公房咨询、信访接待联系方式,各区房地集团直管公房咨询、信访接待联系方式，包括各区房地集团名称、信访接待地址、时间、电话等,房地集团名称，信访接待,城市建设,上海市住房保障和房屋管理局,59,2015年01月20日更新,XLS,11/22/2012,每年,按时,普通公开,1,91,64.84%,194.51%,非外链
http://www.datashanghai.gov.cn/query!queryGdsDataInfoById.action?type=0&dataId=AD4002012004,AD4002012004,物业管理企业基本信息,提供物业管理企业基本信息，包括企业名称、资质证书编号、资质等级、发证日期,物业管理企业,城市建设,上海市住房保障和房屋管理局,79,2015年01月20日更新,XLS,11/22/2012,每年,按时,普通公开,1,86,91.86%,275.58%,非外链
http://www.datashanghai.gov.cn/query!queryGdsDataInfoById.action?type=0&dataId=AD4002012003,AD4002012003,拆迁资质单位基本信息,提供拆迁资质单位基本信息，包括企业名称、资质证书编号、发证日期。,拆迁资质,城市建设,上海市住房保障和房屋管理局,555,2015年01月20日更新,XLS,11/22/2012,每年,按时,普通公开,1,380,146.05%,438.16%,非外链
http://www.datashanghai.gov.cn/query!queryGdsDataInfoById.action?type=0&dataId=AD4002012001,AD4002012001,房地产开发企业基本信息,提供房地产开发企业基本信息，包括房地产开发企业的组织名称、资质证书编号，资质等级以及资质证书发证日期等信息。,"开发企业,资质证书",城市建设,上海市住房保障和房屋管理局,2581,2015年01月20日更新,XLS,11/21/2012,每年,按时,普通公开,1,3056,84.46%,253.37%,非外链
http://www.datashanghai.gov.cn/query!queryGdsDataInfoById.action?type=0&dataId=AD4002015002,AD4002015002,网上房地产一手房可售数据,摘要：住房出售套数、出售面积和普通住房出售套数、出售面积,一手房,民生服务,上海市住房保障和房屋管理局,42,2015年01月19日更新,XLS,1/12/2015,每年,未到更新时间,普通公开,1,77,54.55%,163.64%,非外链
http://www.datashanghai.gov.cn/query!queryGdsDataInfoById.action?type=0&dataId=AD4002015001,AD4002015001,网上房地产二手房可售数据,摘要：住房出售套数，出售面积，普通住房出售套数、出售面积,二手房,民生服务,上海市住房保障和房屋管理局,33,2015年01月19日更新,XLS,1/12/2015,每年,未到更新时间,普通公开,1,69,47.83%,143.48%,非外链
http://www.datashanghai.gov.cn/query!queryGdsDataInfoById.action?type=0&dataId=AD4002012024,AD4002012024,全市房管局系统业务受理处信息,全市房管局系统业务受理处信息包括名称、地址、邮编、电话信息。,业务受理处,机构团体,上海市住房保障和房屋管理局,130,2015年01月19日更新,XLS,12/18/2012,每年,按时,普通公开,1,132,98.48%,295.45%,非外链
http://www.datashanghai.gov.cn/query!queryGdsDataInfoById.action?type=0&dataId=AD4002012021,AD4002012021,四高优秀小区信息,四高优秀小区信息包括区域、项目名称、备注等信息,四高优秀小区,城市建设,上海市住房保障和房屋管理局,188,2015年01月19日更新,XLS,12/14/2012,每年,按时,普通公开,1,168,111.90%,335.71%,非外链
http://www.datashanghai.gov.cn/query!queryGdsDataInfoById.action?type=0&dataId=AD4002012020,AD4002012020,房地产评估企业信息,包含房地产评估企业信息包括企业名称、法定代表人信息。,房地产评估企业,城市建设,上海市住房保障和房屋管理局,52,2015年01月19日更新,XLS,12/18/2012,每年,按时,普通公开,1,65,80.00%,240.00%,非外链
http://www.datashanghai.gov.cn/query!queryGdsDataInfoById.action?type=0&dataId=AD4002012019,AD4002012019,房地产交易中心名录,房地产交易中心名录包括单位、联系地址、邮政编码信息。,房地产交易中心,机构团体,上海市住房保障和房屋管理局,173,2015年01月19日更新,XLS,12/14/2012,每年,按时,普通公开,1,92,188.04%,564.13%,非外链
http://www.datashanghai.gov.cn/query!queryGdsDataInfoById.action?type=0&dataId=AD4002012018,AD4002012018,房屋质量检测人员信息,房屋质量检测人员信息包括姓名、性别、证书编号、资格类别等信息。,房屋质量检测人员,城市建设,上海市住房保障和房屋管理局,56,2015年01月19日更新,XLS,12/18/2012,每年,按时,普通公开,1,67,83.58%,250.75%,非外链
http://www.datashanghai.gov.cn/query!queryGdsDataInfoById.action?type=0&dataId=AD4002012017,AD4002012017,上海市房屋质量检测推荐单位信息,上海市房屋质量检测推荐单位信息包括检测单位名称、地址信息。,房屋质量检测,城市建设,上海市住房保障和房屋管理局,52,2015年01月19日更新,XLS,12/14/2012,每年,按时,普通公开,1,68,76.47%,229.41%,非外链
http://www.datashanghai.gov.cn/query!queryGdsDataInfoById.action?type=0&dataId=AD4002012015,AD4002012015,拆房安全管理办事机构名录,拆房安全管理办事机构名录包括区县、地址、邮编、联系电话信息。,拆房安全管理办事机构,机构团体,上海市住房保障和房屋管理局,58,2015年01月19日更新,XLS,12/18/2012,每年,按时,普通公开,1,68,85.29%,255.88%,非外链
http://www.datashanghai.gov.cn/query!queryGdsDataInfoById.action?type=0&dataId=AD4002012014,AD4002012014,市筹公租房申请受理点信息,市筹公租房申请受理点信息包括受理点名称、受理点地址、受理点电话等信息。,公租房申请受理点,机构团体,上海市住房保障和房屋管理局,116,2015年01月19日更新,XLS,12/14/2012,每年,按时,普通公开,1,101,114.85%,344.55%,非外链
http://www.datashanghai.gov.cn/query!queryGdsDataInfoById.action?type=0&dataId=AD4002012013,AD4002012013,区县住房保障中心名录,区县住房保障中心名录把提供保障中心名称、地址、邮编、电话等信息。,住房保障中心名录,机构团体,上海市住房保障和房屋管理局,66,2015年01月19日更新,XLS,12/14/2012,每年,按时,普通公开,1,84,78.57%,235.71%,非外链
http://www.datashanghai.gov.cn/query!queryGdsDataInfoById.action?type=0&dataId=AD4002012023,AD4002012023,区（县）房管部门名录,区（县）房管部门名录包括名称、地址、邮编等信息。,房管部门名录,机构团体,上海市住房保障和房屋管理局,90,2015年01月19日更新,XLS,12/14/2012,每年,按时,普通公开,1,88,102.27%,306.82%,非外链
http://www.datashanghai.gov.cn/query!queryGdsDataInfoById.action?type=0&dataId=AG9002015014,AG9002015014,就业促进中心相关信息,市、区县两级就业促进中心的名称、地址、联系电话、服务时间、附近交通等相关服务信息,"机构名称,地址，联系电话,服务时间,附近交通",社会发展,上海市人力资源和社会保障局,74,2015年01月19日更新,XLSX,1/19/2015,每半年,未到更新时间,普通公开,1,95,77.89%,233.68%,非外链
http://www.datashanghai.gov.cn/query!queryGdsDataInfoById.action?type=0&dataId=AE9002014005,AE9002014005,上海市税收收入统计情况,按季度、分税种提供上海市全市税收收入统计情况，包含税收收入合计、各税种收入情况、出口退税情况等信息。,上海市税收收入统计情况,经济建设,上海市地方税务局,42,2015年01月16日更新,XLS,12/11/2014,每季度,不按时,普通公开,1,99,42.42%,127.27%,非外链
http://www.datashanghai.gov.cn/query!queryGdsDataInfoById.action?type=0&dataId=AE9002014007,AE9002014007,各直属税务分局对外服务窗口,提供上海市各直属税务分局对外服务窗口信息，包含对外服务窗口名称、详细地址、 联系电话等信息。,各直属税务分局对外服务窗口,机构团体,上海市地方税务局,77,2015年01月16日更新,XLS,12/11/2014,每年,按时,普通公开,1,75,102.67%,308.00%,非外链
http://www.datashanghai.gov.cn/query!queryGdsDataInfoById.action?type=0&dataId=AE9002014008,AE9002014008,各区县办税服务厅个人房产税专窗,提供上海市各区县办理个人房产税事项的办税服务厅信息，包含办税服务厅名称、办税服务厅地址、服务时间、咨询电话等信息。,各区县办税服务厅个人房产税专窗,民生服务,上海市地方税务局,30,2015年01月16日更新,XLS,12/11/2014,每年,按时,普通公开,1,67,44.78%,134.33%,非外链
http://www.datashanghai.gov.cn/query!queryGdsDataInfoById.action?type=0&dataId=AE9002014009,AE9002014009,上海市各区县税务局私房出租代征点信息,提供上海市各区县税务局私房出租代征点信息，包含所属区县、征收点名称、地址、电话、接听时间、责任部门等信息。,上海市各区县税务局私房出租代征点信息,民生服务,上海市地方税务局,28,2015年01月16日更新,XLS,12/11/2014,每年,按时,普通公开,1,72,38.89%,116.67%,非外链
http://www.datashanghai.gov.cn/query!queryGdsDataInfoById.action?type=0&dataId=AE9002014006,AE9002014006,各区县税务分局对外服务窗口,提供上海市各区县税务分局对外服务窗口信息，包含单位名称、办税服务厅地址、办税服务厅电话、接听时间、责任部门等信息。,各区县税务分局对外服务窗口，办税服务厅,机构团体,上海市地方税务局,77,2015年01月16日更新,XLS,12/11/2014,每年,按时,普通公开,1,80,96.25%,288.75%,非外链
http://www.datashanghai.gov.cn/query!queryGdsDataInfoById.action?type=0&dataId=AC9002015009,AC9002015009,上海旅游名牌产品名录,2014年至2015年上海旅游名牌产品名录，包含所述旅游企业、商标、产品名称、有效期、咨询电话等信息,旅游名牌产品,文化休闲,上海市旅游局,78,2015年01月16日更新,XLSX,1/16/2015,每年,未到更新时间,普通公开,1,93,83.87%,251.61%,非外链
http://www.datashanghai.gov.cn/query!queryGdsDataInfoById.action?type=0&dataId=AC9002015008,AC9002015008,上海旅游行业管理机构,上海各区县旅游行业管理机构名单，包括名称、地址、联系电话、传真、周边交通等内容,旅游行业管理机构,机构团体,上海市旅游局,54,2015年01月16日更新,XLSX,1/16/2015,每年,未到更新时间,普通公开,1,82,65.85%,197.56%,非外链
http://www.datashanghai.gov.cn/query!queryGdsDataInfoById.action?type=0&dataId=AC9002015007,AC9002015007,上海市A级景区名单,截至2014年底，上海市A级景区名单，包含景区名称、景区等级、联系电话、景区地址、周边交通、景区简介等信息,旅游，A级景区,文化休闲,上海市旅游局,24,2015年01月16日更新,XLS,1/16/2015,每年,未到更新时间,普通公开,1,91,26.37%,79.12%,非外链
http://www.datashanghai.gov.cn/query!queryGdsDataInfoById.action?type=0&dataId=AC9002015006,AC9002015006,上海市星级饭店名单,上海市星级饭店名单，包含星级饭店的名称、星级、地址、联系电话和所属区县等信息,旅游，星级饭店,文化休闲,上海市旅游局,83,2015年01月16日更新,XLSX,1/16/2015,每年,未到更新时间,普通公开,1,75,110.67%,332.00%,非外链
http://www.datashanghai.gov.cn/query!queryGdsDataInfoById.action?type=0&dataId=AC9002015005,AC9002015005,上海市领队人员名单,上海市领队人员名单，包含领队的姓名、性别、领队证号码、所属旅游企业等信息,旅游，领队,文化休闲,上海市旅游局,24,2015年01月16日更新,XLS,1/16/2015,每年,未到更新时间,普通公开,1,78,30.77%,92.31%,非外链
http://www.datashanghai.gov.cn/query!queryGdsDataInfoById.action?type=0&dataId=AC9002015004,AC9002015004,上海市导游人员名单,上海市导游人员姓名、性别、资格证号、服务语种、导游等级和所属旅行社等信息,旅游，导游,文化休闲,上海市旅游局,25,2015年01月16日更新,XLS,1/16/2015,每年,未到更新时间,普通公开,1,68,36.76%,110.29%,非外链
http://www.datashanghai.gov.cn/query!queryGdsDataInfoById.action?type=0&dataId=AC9002015003,AC9002015003,上海市旅行社名单,上海市现有旅行社名单，包含了旅行社名称、许可证号、地址、电话、等级等信息,旅行社，名称，许可证号，地址，电话，等级,文化休闲,上海市旅游局,25,2015年01月16日更新,XLS,1/16/2015,每年,未到更新时间,普通公开,1,72,34.72%,104.17%,非外链
http://www.datashanghai.gov.cn/query!queryGdsDataInfoById.action?type=0&dataId=AC7002015001,AC7002015001,产品质量监督抽查信息,在商品生产制造环节，对生产企业的产品进行抽样检查，记录产品抽查的结果与具体情况。,"产品质量,监督抽查",经济建设,上海市质量技术监督局,28,2015年01月14日更新,XLSX,1/14/2015,每季度,不按时,特定公开,1,81,34.57%,103.70%,非外链
http://www.datashanghai.gov.cn/query!queryGdsDataInfoById.action?type=0&dataId=AC7002015006,AC7002015006,企业监管信息,包括企业名称、组织机构代码、注册地址、生产地址、检查日期、处理措施,监管,经济建设,上海市质量技术监督局,209,2015年01月14日更新,XLSX,1/14/2015,每季度,不按时,特定公开,1,84,248.81%,746.43%,非外链
http://www.datashanghai.gov.cn/query!queryGdsDataInfoById.action?type=0&dataId=AC7002015005,AC7002015005,质监局机构信息,包括质监局直属行政机构（各区县局）及直属事业单位，截止至2014年12月31日,质监机构,机构团体,上海市质量技术监督局,49,2015年01月14日更新,XLSX,1/14/2015,每年,未到更新时间,普通公开,1,71,69.01%,207.04%,非外链
http://www.datashanghai.gov.cn/query!queryGdsDataInfoById.action?type=0&dataId=AC7002015004,AC7002015004,许可执业人员获证信息,包括获证人员姓名、出生年月、证书名称和作业类型（特种设备作业人员）,作业人员,经济建设,上海市质量技术监督局,24,2015年01月14日更新,XLSX,1/14/2015,每季度,不按时,特定公开,1,68,35.29%,105.88%,非外链
http://www.datashanghai.gov.cn/query!queryGdsDataInfoById.action?type=0&dataId=AC7002015002,AC7002015002,检验检测机构信息,上海市各检验检测机构的信息，包括机构名称、地址、联系电话及工作范围,"检测机构,检验机构",机构团体,上海市质量技术监督局,187,2015年01月14日更新,XLSX,1/14/2015,每年,未到更新时间,特定公开,1,70,267.14%,801.43%,非外链
http://www.datashanghai.gov.cn/query!queryGdsDataInfoById.action?type=0&dataId=AC9002015002,AC9002015002,旅游集散中心,上海旅游集散总站及分站一览表，包括名称、地址、联系电话、周边交通,旅游，集散,文化休闲,上海市旅游局,72,2015年01月13日更新,XLSX,1/13/2015,每年,未到更新时间,普通公开,1,80,90.00%,270.00%,非外链
