url,id,title,desc,tag,category,organization,num_of_downloads,updated_date,format,publication_date,update_frequency,updated_on_time,publication_type,num_of_files,num_of_visits,download_rate,download_rate_fixed,external
http://www.datashanghai.gov.cn/query!queryGdsDataInfoById.action?type=0&dataId=AH1002015007,AH1002015007,停车场（库、位）,包括了3221条上海停车场（库、位）的备案证号、地址、核定收费标准、时间、电话等信息,"上海停车场（库、位）的备案证号,地址,核定收费标准,时间,电话",道路交通,上海市交通委员会,44,2015年01月13日更新,XLSX,1/13/2015,每半年,未到更新时间,普通公开,1,143,30.77%,92.31%,非外链
http://www.datashanghai.gov.cn/query!queryGdsDataInfoById.action?type=0&dataId=AC9002015001,AC9002015001,旅游咨询中心,上海全市17个区县旅游咨询服务中心（亭）一览表，包括名称、地址、电话、周边交通,旅游，咨询服务中心,文化休闲,上海市旅游局,86,2015年01月13日更新,XLS,1/13/2015,每年,未到更新时间,普通公开,1,86,100.00%,300.00%,非外链
http://www.datashanghai.gov.cn/query!queryGdsDataInfoById.action?type=0&dataId=AH1002015006,AH1002015006,停车场静态信息,上海全市停车场核定收费标准、营业时间、联系电话、车位数、停车场性质、入口地址、出口地址等信息,"停车场核定收费标准,营业时间,联系电话,车位数,停车场性质,入口地址,出口地址",道路交通,上海市交通委员会,30,2015年01月13日更新,XLSX,1/13/2015,每半年,未到更新时间,普通公开,1,103,29.13%,87.38%,非外链
http://www.datashanghai.gov.cn/query!queryGdsDataInfoById.action?type=0&dataId=AH2002015009,AH2002015009,自然保护区,上海市自然保护区数据，主要包括：名称、级别、主要保护对象、保护/规划面积、行政区域、建立规划时间等。,自然保护区,民生服务,上海市绿化和市容管理局,77,2015年01月13日更新,XLSX,1/13/2015,每年,未到更新时间,特定公开,1,69,111.59%,334.78%,非外链
http://www.datashanghai.gov.cn/query!queryGdsDataInfoById.action?type=0&dataId=AH2002015007,AH2002015007,湿地,上海市主要湿地。主要包括：湿地名称、面积、所属区县。上海市主要湿地。主要包括：湿地名称、面积、所属区县。,湿地,民生服务,上海市绿化和市容管理局,61,2015年01月13日更新,XLSX,1/13/2015,每年,未到更新时间,特定公开,1,71,85.92%,257.75%,非外链
http://www.datashanghai.gov.cn/query!queryGdsDataInfoById.action?type=0&dataId=AH1002015005,AH1002015005,公交线路首末班车时间,全市1470条公交线路的上行首末班车时刻表和下行首末班车时刻表,"公交线路,首班车,末班车，时刻表",道路交通,上海市交通委员会,18,2015年01月13日更新,XLSX,1/13/2015,每半年,未到更新时间,普通公开,1,87,20.69%,62.07%,非外链
http://www.datashanghai.gov.cn/query!queryGdsDataInfoById.action?type=0&dataId=AH2002015006,AH2002015006,车辆清洗点,本数据为机动车辆清洗点，为市容处管理范畴。现为备案制。包括名称、地址和所属区县。,车辆清洗点,民生服务,上海市绿化和市容管理局,51,2015年01月13日更新,XLSX,1/13/2015,每年,未到更新时间,特定公开,1,73,69.86%,209.59%,非外链
http://www.datashanghai.gov.cn/query!queryGdsDataInfoById.action?type=0&dataId=AH1002015004,AH1002015004,车辆统计信息,包括全市的公交、出租、驾培、客运、货运信息的车辆总数，供市民查询,公交、出租、驾培、客运、货运信息的车辆总数,道路交通,上海市交通委员会,33,2015年01月13日更新,XLSX,1/13/2015,每半年,未到更新时间,普通公开,1,105,31.43%,94.29%,非外链
http://www.datashanghai.gov.cn/query!queryGdsDataInfoById.action?type=0&dataId=AH1002015003,AH1002015003,机动车维修企业,包括上海地区的机动车维修的企业名称、经营地址、经营范围、联系电话等字段,"机动车维修的企业名称,经营地址,经营范围,联系电话",民生服务,上海市交通委员会,17,2015年01月13日更新,XLSX,1/13/2015,每半年,未到更新时间,普通公开,1,57,29.82%,89.47%,非外链
http://www.datashanghai.gov.cn/query!queryGdsDataInfoById.action?type=0&dataId=AA9002014008,AA9002014008,烈士陵园,本市烈士陵园的机构名称、所属区县、所属街道、地址、联系电话、机构性质、简介等信息。,烈士陵园,民生服务,上海市民政局,68,2015年01月13日更新,XLS,12/29/2014,每年,未到更新时间,普通公开,1,90,75.56%,226.67%,非外链
http://www.datashanghai.gov.cn/query!queryGdsDataInfoById.action?type=0&dataId=AB6002015022,AB6002015022,上海市技术进出口交易会亮点企业情况,上海市技术进出口交易会亮点企业情况数据产品主要发布了上海市技术进出口交易会亮点项目名称、亮点、基本情况、本届上交会特色展品（技术）等信息。,"技术进出口,亮点企业",经济建设,上海市商务委员会,24,2015年01月05日更新,XLSX,1/5/2015,每年,未到更新时间,普通公开,1,73,32.88%,98.63%,外链
http://www.datashanghai.gov.cn/query!queryGdsDataInfoById.action?type=0&dataId=AB6002015021,AB6002015021,上海主要国际展览会信息,上海主要国际展览会信息数据产品主要发布了上海市主要国际展览会名称、计划办展时间、展览场地等信息。,国际展览会,经济建设,上海市商务委员会,12,2015年01月05日更新,XLSX,1/5/2015,每半年,未到更新时间,普通公开,1,80,15.00%,45.00%,外链
http://www.datashanghai.gov.cn/query!queryGdsDataInfoById.action?type=0&dataId=AB6002015020,AB6002015020,上海主要展馆信息,上海主要展馆信息数据产品主要发布了上海市主要展馆名称、地理位置、场馆介绍等信息。,展馆,经济建设,上海市商务委员会,11,2015年01月05日更新,XLSX,1/5/2015,每年,未到更新时间,普通公开,1,79,13.92%,41.77%,外链
http://www.datashanghai.gov.cn/query!queryGdsDataInfoById.action?type=0&dataId=AB6002015019,AB6002015019,再生资源回收网点备案信息,再生资源回收网点备案信息数据产品主要发布了上海市再生资源回收网点名称、所属区县、经营地址、联系人、联系电话等信息。,"再生资源,回收网点",资源环境,上海市商务委员会,16,2015年01月05日更新,XLSX,1/5/2015,每季度,不按时,普通公开,1,114,14.04%,42.11%,外链
http://www.datashanghai.gov.cn/query!queryGdsDataInfoById.action?type=0&dataId=AB6002015018,AB6002015018,上海市消费指数信息,上海市消费指数信息数据产品主要发布了上海市每月消费市场指数的信息。,消费指数,经济建设,上海市商务委员会,7,2015年01月05日更新,XLSX,1/5/2015,每月,不按时,普通公开,1,48,14.58%,43.75%,外链
http://www.datashanghai.gov.cn/query!queryGdsDataInfoById.action?type=0&dataId=AB6002015017,AB6002015017,上海对外直接投资核准额,上海对外直接投资核准额数据产品主要发布了上海市对外直接投资核准投资总额及核准中方投资额情况。,对外直接投资,经济建设,上海市商务委员会,6,2015年01月05日更新,XLSX,1/5/2015,每月,不按时,普通公开,1,46,13.04%,39.13%,外链
http://www.datashanghai.gov.cn/query!queryGdsDataInfoById.action?type=0&dataId=AB6002015016,AB6002015016,上海对外劳务合作派遣人数、月末在外人数,上海对外劳务合作派遣人数、月末在外人数数据产品主要发布了上海市对外劳务合作派遣人员情况。,劳务合作,社会发展,上海市商务委员会,8,2015年01月05日更新,XLSX,1/5/2015,每月,不按时,普通公开,1,67,11.94%,35.82%,外链
http://www.datashanghai.gov.cn/query!queryGdsDataInfoById.action?type=0&dataId=AB6002015015,AB6002015015,上海对外承包工程完成营业额、新签合同额,上海对外承包工程完成营业额、新签合同额数据产品主要发布了上海市对外承包工程新签合同及完成情况。,对外承包工程,经济建设,上海市商务委员会,6,2015年01月05日更新,XLSX,1/5/2015,每月,不按时,普通公开,1,51,11.76%,35.29%,外链
http://www.datashanghai.gov.cn/query!queryGdsDataInfoById.action?type=0&dataId=AB6002015013,AB6002015013,上海市粮食批发行情,上海市粮食批发行情数据产品主要发布了上海市粮食批发行情的信息。,粮食批发,民生服务,上海市商务委员会,11,2015年01月05日更新,XLSX,1/5/2015,每周,不按时,普通公开,1,67,16.42%,49.25%,外链
http://www.datashanghai.gov.cn/query!queryGdsDataInfoById.action?type=0&dataId=AB6002015012,AB6002015012,上海市活鸡批发行情,上海市活鸡批发行情数据产品主要发布了上海市活鸡批发行情的信息。,活鸡批发,民生服务,上海市商务委员会,14,2015年01月05日更新,XLSX,1/5/2015,每周,不按时,普通公开,1,75,18.67%,56.00%,外链
http://www.datashanghai.gov.cn/query!queryGdsDataInfoById.action?type=0&dataId=AB6002015011,AB6002015011,上海市肉品批发行情,上海市肉品批发行情数据产品主要发布了上海市肉品批发行情的信息。,肉品批发,民生服务,上海市商务委员会,10,2015年01月05日更新,XLSX,1/5/2015,每周,不按时,普通公开,1,43,23.26%,69.77%,外链
http://www.datashanghai.gov.cn/query!queryGdsDataInfoById.action?type=0&dataId=AB6002015010,AB6002015010,上海市货物贸易出口情况,上海市货物贸易出口情况数据产品发布了上海市货物贸易当月出口额、当月出口同比、当年累计出口额、当年累计出口同比等情况。,"贸易,出口",经济建设,上海市商务委员会,8,2015年01月05日更新,XLSX,1/5/2015,每月,不按时,普通公开,1,55,14.55%,43.64%,外链
http://www.datashanghai.gov.cn/query!queryGdsDataInfoById.action?type=0&dataId=AB6002015009,AB6002015009,上海市货物贸易进口情况,上海市货物贸易进口情况数据产品主要发布了上海市货物贸易当月进口额、当月进口同比、当年累计进口额、当年累计进口同比等情况。,"贸易,进口",经济建设,上海市商务委员会,7,2015年01月05日更新,XLSX,1/5/2015,每月,不按时,普通公开,1,50,14.00%,42.00%,外链
http://www.datashanghai.gov.cn/query!queryGdsDataInfoById.action?type=0&dataId=AB6002015008,AB6002015008,上海外商第三产业合同投资情况,上海外商第三产业合同投资情况数据产品主要发布了上海市外商第三产业合同投资近金额、同比增长等数据信息。,"外商,第三产业,合同投资",经济建设,上海市商务委员会,5,2015年01月05日更新,XLSX,1/5/2015,每月,不按时,普通公开,1,45,11.11%,33.33%,外链
http://www.datashanghai.gov.cn/query!queryGdsDataInfoById.action?type=0&dataId=AB6002015007,AB6002015007,上海市外商实际投资情况,上海市外商实际投资情况数据产品主要发布了上海市外商实际投资金额、同比增长等数据信息。,"外商,投资",经济建设,上海市商务委员会,9,2015年01月05日更新,XLSX,1/5/2015,每月,不按时,普通公开,1,66,13.64%,40.91%,外链
http://www.datashanghai.gov.cn/query!queryGdsDataInfoById.action?type=0&dataId=AB6002015006,AB6002015006,上海市外商合同投资情况,上海市外商合同投资情况数据产品主要发布了上海市外商投资合同金额、同比增长等数据信息。,"外商,合同投资",经济建设,上海市商务委员会,7,2015年01月05日更新,XLSX,1/5/2015,每月,不按时,普通公开,1,57,12.28%,36.84%,外链
http://www.datashanghai.gov.cn/query!queryGdsDataInfoById.action?type=0&dataId=AB6002015005,AB6002015005,上海社会消费品零售情况,上海社会消费品零售情况数据产品主要发布了上海市历年以来社会消费品零售总额的情况。,"社会消费品,零售",经济建设,上海市商务委员会,8,2015年01月05日更新,XLSX,1/5/2015,每月,不按时,普通公开,1,58,13.79%,41.38%,外链
http://www.datashanghai.gov.cn/query!queryGdsDataInfoById.action?type=0&dataId=AB9002015004,AB9002015004,海洋经济统计数据,年度海洋经济运行监测、海洋经济分析评估信息主要统计历年全国及上海海洋生产总值,海洋经济，分析评估，统计信息,资源环境,上海市水务局,50,2015年01月04日更新,XLS,1/4/2015,每年,未到更新时间,普通公开,1,120,41.67%,125.00%,非外链
http://www.datashanghai.gov.cn/query!queryGdsDataInfoById.action?type=0&dataId=AB7002014011,AB7002014011,上海市文化产业园区情况一览表,提供上海市国家级文化产业示范园区和基地名单及上海市文化产业园区名单，含园区地址、概况、电话等信息,文化，产业园区,文化休闲,上海市文化广播影视管理局,34,2014年12月31日更新,XLS,12/31/2014,每年,未到更新时间,普通公开,1,111,30.63%,91.89%,非外链
http://www.datashanghai.gov.cn/query!queryGdsDataInfoById.action?type=0&dataId=AB7002014010,AB7002014010,上海市各类演出场所情况一览表,提供上海市各类演出场所的名称、地址、联系电话等各类信息，按主要演出场所、大型演出活动场馆、主要书场等排列,演出，场所,文化休闲,上海市文化广播影视管理局,32,2014年12月31日更新,XLS,12/31/2014,每年,未到更新时间,普通公开,1,89,35.96%,107.87%,非外链
http://www.datashanghai.gov.cn/query!queryGdsDataInfoById.action?type=0&dataId=AB7002014007,AB7002014007,上海各区县受理窗口情况一览表（文化）,提供上海各区县有关文化的各类行政审批受理窗口的名称、地址、电话等各类信息,行政审批   受理,文化休闲,上海市文化广播影视管理局,34,2014年12月31日更新,XLS,12/31/2014,每年,未到更新时间,普通公开,1,89,38.20%,114.61%,非外链
http://www.datashanghai.gov.cn/query!queryGdsDataInfoById.action?type=0&dataId=AB7002014005,AB7002014005,上海市电影院情况一览表,提供上海市各电影院的名称、地址、联系电话等各类信息，按各区县排列,电影院,文化休闲,上海市文化广播影视管理局,91,2014年12月31日更新,XLSX,12/31/2014,每年,未到更新时间,普通公开,1,87,104.60%,313.79%,非外链
http://www.datashanghai.gov.cn/query!queryGdsDataInfoById.action?type=0&dataId=AB7002014001,AB7002014001,上海各类博物馆情况一览表,提供上海市各类博物馆名称、地址、联系电话、开放情况等信息，按区县分别排列,博物馆,文化休闲,上海市文化广播影视管理局,84,2014年12月31日更新,XLS,12/31/2014,每年,未到更新时间,普通公开,1,113,74.34%,223.01%,非外链
http://www.datashanghai.gov.cn/query!queryGdsDataInfoById.action?type=0&dataId=AA9002014018,AA9002014018,精神卫生中心,上海民政精神卫生中心的名称、区县、地址、邮编、联系电话、服务范围、机构性质等信息。,精神卫生中心,卫生健康,上海市民政局,70,2014年12月31日更新,XLS,12/31/2014,每年,未到更新时间,普通公开,1,86,81.40%,244.19%,非外链
http://www.datashanghai.gov.cn/query!queryGdsDataInfoById.action?type=0&dataId=AA9002014011,AA9002014011,骨灰堂,本市骨灰堂的名称、地址、邮编、联系电话、联系人、所属区县、所属街镇、机构性质、建造状态、服务范围、荣誉资质、便民服务等信息。,骨灰堂,民生服务,上海市民政局,29,2014年12月31日更新,XLS,12/29/2014,每半年,未到更新时间,普通公开,1,70,41.43%,124.29%,非外链
http://www.datashanghai.gov.cn/query!queryGdsDataInfoById.action?type=0&dataId=AA9002014010,AA9002014010,殡仪馆,本市殡仪馆的机构名称、地址、邮编、电话、联系人、所属区县、所属街镇、机构性质、建造状态、服务范围、资质荣誉、便民服务等信息,殡仪馆,民生服务,上海市民政局,37,2014年12月31日更新,XLS,12/29/2014,每半年,未到更新时间,普通公开,1,69,53.62%,160.87%,非外链
http://www.datashanghai.gov.cn/query!queryGdsDataInfoById.action?type=0&dataId=AA9002014017,AA9002014017,社区事务受理中心,本市社区事务受理中心的所在区县、所在街道、地址、联系电话、工作时间等信息。,社区事务受理中心,机构团体,上海市民政局,84,2014年12月31日更新,XLSX,12/31/2014,每半年,未到更新时间,普通公开,1,78,107.69%,323.08%,非外链
http://www.datashanghai.gov.cn/query!queryGdsDataInfoById.action?type=0&dataId=AA6002014005,AA6002014005,宗教场所,上海市佛教、道教场所名称、宗教教别、行政区域、地址、负责人、联系电话、情况简介等,宗教场所,民生服务,上海市民族和宗教事务委员会,17,2014年12月30日更新,XLS,12/30/2014,每年,未到更新时间,普通公开,1,70,24.29%,72.86%,非外链
http://www.datashanghai.gov.cn/query!queryGdsDataInfoById.action?type=0&dataId=AA9002014016,AA9002014016,经常性社会救助接收点,经常性社会救助接收点的机构地址、所属区县、所属街道、地址、联系电话、联系人等信息。,经常性社会救助接收点,民生服务,上海市民政局,20,2014年12月29日更新,XLS,12/29/2014,每半年,未到更新时间,普通公开,1,79,25.32%,75.95%,非外链
http://www.datashanghai.gov.cn/query!queryGdsDataInfoById.action?type=0&dataId=AA9002014015,AA9002014015,慈善超市,慈善超市的机构名称、所属区县、所属街道、地址、联系电话、联系人等信息。,慈善超市,民生服务,上海市民政局,27,2014年12月29日更新,XLS,12/29/2014,每半年,未到更新时间,普通公开,1,71,38.03%,114.08%,非外链
http://www.datashanghai.gov.cn/query!queryGdsDataInfoById.action?type=0&dataId=AA9002014014,AA9002014014,海葬服务机构,本市海葬服务机构的名称、地址、邮编、电话、联系人、所属区县、所属街镇、机构性质、建造状态、服务范围、便民服务等信息。,海葬,民生服务,上海市民政局,38,2014年12月29日更新,XLS,12/29/2014,每年,未到更新时间,普通公开,1,57,66.67%,200.00%,非外链
http://www.datashanghai.gov.cn/query!queryGdsDataInfoById.action?type=0&dataId=AA9002014013,AA9002014013,殡葬服务代理机构,本市殡葬服务代理机构的机构名称、地址、邮编、电话、联系人、所属区县、所属街镇、机构性质、建造状态、服务范围等信息。,殡葬服务代理机构,民生服务,上海市民政局,20,2014年12月29日更新,XLS,12/29/2014,每年,未到更新时间,普通公开,1,62,32.26%,96.77%,非外链
http://www.datashanghai.gov.cn/query!queryGdsDataInfoById.action?type=0&dataId=AA9002014012,AA9002014012,公墓,本市公墓的名称、地址、邮编、电话、联系人、所属区县、所属街道、机构性质、建造状态、服务范围、荣誉资质、便民服务等信息。,公墓,民生服务,上海市民政局,30,2014年12月29日更新,XLS,12/29/2014,每半年,未到更新时间,普通公开,1,55,54.55%,163.64%,非外链
http://www.datashanghai.gov.cn/query!queryGdsDataInfoById.action?type=0&dataId=AA9002014009,AA9002014009,婚姻登记机构,本市婚姻登记机构所属区县、地址、结婚接待时间、离婚接待时间、语音电话、接待电话等信息。,婚姻登记,机构团体,上海市民政局,58,2014年12月29日更新,XLSX,12/29/2014,每半年,未到更新时间,普通公开,1,66,87.88%,263.64%,非外链
http://www.datashanghai.gov.cn/query!queryGdsDataInfoById.action?type=0&dataId=AA9002014007,AA9002014007,救助管理站,救助管理站的机构名称、所属区县、联系地址、联系电话、工作时间等信息。,救助管理站,民生服务,上海市民政局,22,2014年12月29日更新,XLS,12/29/2014,每半年,未到更新时间,普通公开,1,95,23.16%,69.47%,非外链
http://www.datashanghai.gov.cn/query!queryGdsDataInfoById.action?type=0&dataId=AA9002014006,AA9002014006,慈善救助服务社,慈善救助服务社的机构名称、所属区县、地址、电话、工作时间等信息。,慈善救助服务社,民生服务,上海市民政局,60,2014年12月29日更新,XLS,12/29/2014,每半年,未到更新时间,普通公开,1,74,81.08%,243.24%,非外链
http://www.datashanghai.gov.cn/query!queryGdsDataInfoById.action?type=0&dataId=AA9002014005,AA9002014005,上海市养老机构,上海市养老机构的名称、所属区县、所属街镇、地址、邮政编码、联系电话、工作时间等信息。,养老机构,民生服务,上海市民政局,28,2014年12月29日更新,XLSX,12/29/2014,每半年,未到更新时间,普通公开,1,77,36.36%,109.09%,非外链
http://www.datashanghai.gov.cn/query!queryGdsDataInfoById.action?type=0&dataId=AA9002014004,AA9002014004,社会救助管理机构,社会救助事务所等救助管理机构的名称、所属区县、所属街道、地址、邮编、联系电话和工作时间等信息。,社会救助,机构团体,上海市民政局,49,2014年12月29日更新,XLS,12/29/2014,每半年,未到更新时间,普通公开,1,82,59.76%,179.27%,非外链
http://www.datashanghai.gov.cn/query!queryGdsDataInfoById.action?type=0&dataId=AC6002012014,AC6002012014,全市工商行政管理机关和工商所分布数据,提供上海市工商行政管理局机关及全市工商所分局数据，包括工商所名称、地址等。,工商行政管理机关，工商所,机构团体,上海市工商行政管理局,75,2014年12月29日更新,doc,11/23/2012,每年,按时,普通公开,1,170,44.12%,132.35%,非外链
http://www.datashanghai.gov.cn/query!queryGdsDataInfoById.action?type=0&dataId=AC6002012015,AC6002012015,全市消费维权点分布数据,提供全市消费维权点分布数据，包括所属区县、联络点名称	、联络点地址、联系电话等信息。,消费维权点，地址,机构团体,上海市工商行政管理局,46,2014年12月29日更新,XLS,11/23/2012,每年,按时,普通公开,1,143,32.17%,96.50%,非外链
http://www.datashanghai.gov.cn/query!queryGdsDataInfoById.action?type=0&dataId=AC6002012016,AC6002012016,上海市著名商标公告数据,提供上海市著名商标公告数据，包括上海市最新的评定的上海市著名商标及重新认定为上海市的著名商标。,著名商标、公告,民生服务,上海市工商行政管理局,56,2014年12月29日更新,doc,11/23/2012,每年,按时,普通公开,1,102,54.90%,164.71%,非外链
http://www.datashanghai.gov.cn/query!queryGdsDataInfoById.action?type=0&dataId=AC6002012017,AC6002012017,内资企业设立登记公告数据,提供最近想一年上海市工商行政管理局内资企业设立登记的公告数据，包括企业名称等信息。,内资企业设立登记公告数据,经济建设,上海市工商行政管理局,99,2014年12月29日更新,XLS,11/23/2012,每年,按时,普通公开,1,172,57.56%,172.67%,非外链
http://www.datashanghai.gov.cn/query!queryGdsDataInfoById.action?type=0&dataId=AC6002012018,AC6002012018,内资企业名称变更公告数据,提供上海市工商行政管理局最近一年内资企业名称变更登记的公告数据。,内资企业，名称变更，公告,经济建设,上海市工商行政管理局,29,2014年12月29日更新,XLS,11/23/2012,每年,按时,普通公开,1,89,32.58%,97.75%,非外链
http://www.datashanghai.gov.cn/query!queryGdsDataInfoById.action?type=0&dataId=AC6002012019,AC6002012019,内资企业注销公告数据,提供上海市工商行政管理局最近一年内资企业注销登记的公告数据。,内资企业，注销，公告,经济建设,上海市工商行政管理局,30,2014年12月29日更新,XLS,11/23/2012,每年,按时,普通公开,1,102,29.41%,88.24%,非外链
http://www.datashanghai.gov.cn/query!queryGdsDataInfoById.action?type=0&dataId=AC6002012020,AC6002012020,市局外资企业设立公告数据,提供上海市工商行政管理局最近一年市局登记的外资企业设立公告数据。,市局，外资企业，设立，公告,经济建设,上海市工商行政管理局,40,2014年12月29日更新,XLS,11/23/2012,每年,按时,普通公开,1,99,40.40%,121.21%,非外链
http://www.datashanghai.gov.cn/query!queryGdsDataInfoById.action?type=0&dataId=AC6002012021,AC6002012021,市局外资企业名称变更公告数据,提供上海市工商行政管理局最近一年市局登记的外资企业名称变更公告数据。,市局，外资企业，名称变更，公告,经济建设,上海市工商行政管理局,22,2014年12月29日更新,XLS,11/23/2012,每年,按时,普通公开,1,65,33.85%,101.54%,非外链
http://www.datashanghai.gov.cn/query!queryGdsDataInfoById.action?type=0&dataId=AC6002012022,AC6002012022,市局外资企业注销公告数据,提供上海市工商行政管理局最近一年市局登记的外资企业注销公告数据 。,市局外资企业注销公告数据,经济建设,上海市工商行政管理局,19,2014年12月29日更新,XLS,11/23/2012,每年,按时,普通公开,1,65,29.23%,87.69%,非外链
http://www.datashanghai.gov.cn/query!queryGdsDataInfoById.action?type=0&dataId=AC6002012023,AC6002012023,市局外资企业撤销公告数据,提供上海市工商行政管理局最近一年市局登记的外资企业撤销公告数据。,市局，外资企业，撤销，公告,经济建设,上海市工商行政管理局,22,2014年12月29日更新,XLS,11/23/2012,每年,按时,普通公开,1,58,37.93%,113.79%,非外链
http://www.datashanghai.gov.cn/query!queryGdsDataInfoById.action?type=0&dataId=AC6002012024,AC6002012024,市局外国（地区）常驻代表机构设立公告数据,提供上海市工商行政管理局最近一年市局登记的外国（地区）常驻代表机构设立公告数据。,市局，外国（地区）常驻代表机构，设立，公告,经济建设,上海市工商行政管理局,23,2014年12月29日更新,XLS,11/23/2012,每年,按时,普通公开,1,85,27.06%,81.18%,非外链
